{
  "$schema": "https://json-schema.org/draft/2020-12/schema",
  "$id": "https://navigator.govermont.co/civic-record.schema.json",
  "title": "Go Vermont CivicRecordV1",
  "description": "A project-local contract for one reviewed civic source snapshot. It is not a government standard or evidence of municipal endorsement.",
  "type": "object",
  "additionalProperties": false,
  "required": [
    "$schema",
    "schemaVersion",
    "id",
    "canonicalUrl",
    "humanUrl",
    "publisher",
    "governmentEndorsement",
    "jurisdiction",
    "topic",
    "taxYear",
    "historicalAfter",
    "checkedAt",
    "status",
    "scope",
    "lifecycle",
    "claims",
    "canonicalUnknowns",
    "civicPaths",
    "sources",
    "integrity",
    "privacyBoundary"
  ],
  "properties": {
    "$schema": {
      "const": "https://navigator.govermont.co/civic-record.schema.json"
    },
    "schemaVersion": {
      "const": "CivicRecordV1"
    },
    "id": {
      "type": "string",
      "pattern": "^vt:municipality:[a-z0-9-]+:[a-z0-9_-]+:\\d{4}$"
    },
    "canonicalUrl": {
      "type": "string",
      "format": "uri"
    },
    "humanUrl": {
      "type": "string",
      "format": "uri"
    },
    "publisher": {
      "type": "object",
      "additionalProperties": false,
      "required": [
        "name",
        "role"
      ],
      "properties": {
        "name": {
          "type": "string",
          "minLength": 1
        },
        "role": {
          "const": "independent civic publisher"
        }
      }
    },
    "governmentEndorsement": {
      "const": false
    },
    "jurisdiction": {
      "type": "object",
      "additionalProperties": false,
      "required": [
        "id",
        "name",
        "state"
      ],
      "properties": {
        "id": {
          "type": "string",
          "pattern": "^vt:municipality:[a-z0-9-]+$"
        },
        "name": {
          "type": "string",
          "minLength": 1
        },
        "state": {
          "const": "Vermont"
        }
      }
    },
    "topic": {
      "const": "property_tax"
    },
    "taxYear": {
      "type": "integer",
      "minimum": 2000,
      "maximum": 2100
    },
    "historicalAfter": {
      "type": "string",
      "pattern": "^\\d{4}-\\d{2}-\\d{2}$"
    },
    "checkedAt": {
      "type": "string",
      "pattern": "^\\d{4}-\\d{2}-\\d{2}$"
    },
    "status": {
      "const": "reviewed_source_snapshot"
    },
    "scope": {
      "type": "object",
      "additionalProperties": false,
      "required": [
        "establishes",
        "doesNotEstablish"
      ],
      "properties": {
        "establishes": {
          "type": "string",
          "minLength": 1
        },
        "doesNotEstablish": {
          "type": "string",
          "minLength": 1
        }
      }
    },
    "lifecycle": {
      "type": "array",
      "minItems": 1,
      "items": {
        "type": "object",
        "additionalProperties": false,
        "required": [
          "stage",
          "status",
          "responsibility"
        ],
        "properties": {
          "stage": {
            "type": "string",
            "minLength": 1
          },
          "status": {
            "type": "string",
            "minLength": 1
          },
          "responsibility": {
            "type": "string",
            "minLength": 1
          }
        }
      }
    },
    "claims": {
      "type": "array",
      "minItems": 1,
      "items": {
        "type": "object",
        "additionalProperties": false,
        "required": [
          "id",
          "citationUrl",
          "statement",
          "limitation",
          "checkedAt",
          "sourceIds"
        ],
        "properties": {
          "id": {
            "type": "string",
            "pattern": "^[a-z0-9-]+$"
          },
          "citationUrl": {
            "type": "string",
            "format": "uri"
          },
          "statement": {
            "type": "string",
            "minLength": 1
          },
          "limitation": {
            "type": "string",
            "minLength": 1
          },
          "checkedAt": {
            "type": "string",
            "pattern": "^\\d{4}-\\d{2}-\\d{2}$"
          },
          "sourceIds": {
            "type": "array",
            "minItems": 1,
            "items": {
              "type": "string"
            }
          }
        }
      }
    },
    "canonicalUnknowns": {
      "type": "array",
      "minItems": 1,
      "items": {
        "type": "string",
        "minLength": 1
      }
    },
    "civicPaths": {
      "type": "array",
      "minItems": 1,
      "items": {
        "type": "object",
        "additionalProperties": false,
        "required": [
          "id",
          "citationUrl",
          "label",
          "office",
          "purpose",
          "contactMode",
          "checkedAt",
          "staleAfter",
          "limitation",
          "sourceId"
        ],
        "properties": {
          "id": {
            "type": "string",
            "pattern": "^[a-z0-9-]+$"
          },
          "citationUrl": {
            "type": "string",
            "format": "uri"
          },
          "label": {
            "type": "string",
            "minLength": 1
          },
          "office": {
            "type": "string",
            "minLength": 1
          },
          "purpose": {
            "type": "string",
            "minLength": 1
          },
          "contactMode": {
            "type": "string",
            "minLength": 1
          },
          "checkedAt": {
            "type": "string",
            "pattern": "^\\d{4}-\\d{2}-\\d{2}$"
          },
          "staleAfter": {
            "type": "string",
            "pattern": "^\\d{4}-\\d{2}-\\d{2}$"
          },
          "limitation": {
            "type": "string",
            "minLength": 1
          },
          "sourceId": {
            "type": "string",
            "minLength": 1
          }
        }
      }
    },
    "sources": {
      "type": "array",
      "minItems": 1,
      "items": {
        "type": "object",
        "additionalProperties": false,
        "required": [
          "id",
          "title",
          "publisher",
          "canonicalUrl",
          "access",
          "checkedAt",
          "retrievedAt",
          "taxYear",
          "effectiveDate",
          "locator",
          "evidenceSummary",
          "capturedEvidenceSha256"
        ],
        "properties": {
          "id": {
            "type": "string",
            "pattern": "^[a-z0-9-]+$"
          },
          "title": {
            "type": "string",
            "minLength": 1
          },
          "publisher": {
            "type": "string",
            "minLength": 1
          },
          "canonicalUrl": {
            "anyOf": [
              {
                "type": "string",
                "format": "uri"
              },
              {
                "type": "null"
              }
            ]
          },
          "access": {
            "enum": [
              "linked_official_source",
              "url_withheld_from_machine_projection"
            ]
          },
          "checkedAt": {
            "type": "string",
            "pattern": "^\\d{4}-\\d{2}-\\d{2}$"
          },
          "retrievedAt": {
            "type": "string",
            "pattern": "^\\d{4}-\\d{2}-\\d{2}$"
          },
          "taxYear": {
            "anyOf": [
              {
                "type": "integer"
              },
              {
                "type": "null"
              }
            ]
          },
          "effectiveDate": {
            "anyOf": [
              {
                "type": "string",
                "pattern": "^\\d{4}-\\d{2}-\\d{2}$"
              },
              {
                "type": "null"
              }
            ]
          },
          "locator": {
            "type": "string",
            "minLength": 1
          },
          "evidenceSummary": {
            "type": "string",
            "minLength": 1
          },
          "capturedEvidenceSha256": {
            "type": "string",
            "pattern": "^[a-f0-9]{64}$"
          }
        }
      }
    },
    "integrity": {
      "type": "object",
      "additionalProperties": false,
      "required": [
        "factCount",
        "civicPathCount",
        "sourceCount",
        "sourcePackSemanticSha256"
      ],
      "properties": {
        "factCount": {
          "type": "integer",
          "minimum": 1
        },
        "civicPathCount": {
          "type": "integer",
          "minimum": 1
        },
        "sourceCount": {
          "type": "integer",
          "minimum": 1
        },
        "sourcePackSemanticSha256": {
          "type": "string",
          "pattern": "^[a-f0-9]{64}$"
        }
      }
    },
    "privacyBoundary": {
      "type": "string",
      "minLength": 1
    }
  }
}
