{
  "$schema": "https://navigator.govermont.co/civic-record.schema.json",
  "schemaVersion": "CivicRecordV1",
  "id": "vt:municipality:waterbury:property-tax:2026",
  "canonicalUrl": "https://navigator.govermont.co/civic-record.json",
  "humanUrl": "https://navigator.govermont.co/#public-records",
  "publisher": {
    "name": "802 Flamingo LLC",
    "role": "independent civic publisher"
  },
  "governmentEndorsement": false,
  "jurisdiction": {
    "id": "vt:municipality:waterbury",
    "name": "Waterbury",
    "state": "Vermont"
  },
  "topic": "property_tax",
  "taxYear": 2026,
  "historicalAfter": "2027-06-30",
  "checkedAt": "2026-08-31",
  "status": "reviewed_source_snapshot",
  "scope": {
    "establishes": "What the cited official records say about Waterbury's published 2026 property-tax rates, classifications, and reviewed starting points.",
    "doesNotEstablish": "Why an individual bill changed, which classification or adjustment applies, eligibility, liability, or a final answer for a resident."
  },
  "lifecycle": [
    {
      "stage": "official_records_reviewed",
      "status": "complete",
      "responsibility": "802 Flamingo LLC"
    },
    {
      "stage": "resident_context",
      "status": "not_in_public_record",
      "responsibility": "resident"
    },
    {
      "stage": "starting_path_selected",
      "status": "resident_choice_required",
      "responsibility": "resident"
    },
    {
      "stage": "draft_preparation",
      "status": "available_after_resident_choice",
      "responsibility": "resident"
    },
    {
      "stage": "external_action",
      "status": "not_performed_by_go_vermont",
      "responsibility": "resident"
    }
  ],
  "claims": [
    {
      "id": "waterbury-2026-rates",
      "citationUrl": "https://navigator.govermont.co/records/waterbury-2026-rates/",
      "statement": "For 2026, Waterbury publishes a total municipal rate of $0.5552 per $100 of assessed value. Its education rates are $2.2567 for homestead property and $2.2482 for nonhomestead property, producing combined rates of $2.8119 and $2.8034.",
      "limitation": "These town-wide rates do not establish why any individual bill changed or which classification applies to a particular property.",
      "checkedAt": "2026-08-31",
      "sourceIds": [
        "waterbury-tax-rates-2026",
        "waterbury-tax-bills-2026",
        "waterbury-property-taxes"
      ]
    },
    {
      "id": "waterbury-2026-change-pattern",
      "citationUrl": "https://navigator.govermont.co/records/waterbury-2026-change-pattern/",
      "statement": "Waterbury's 2026 rate page describes its municipal rate as slightly lower while both education rates increased.",
      "limitation": "The exact municipal percentage change is withheld because the page's prior baseline does not reconcile with the issued 2025 bills. The pattern still cannot explain a particular bill.",
      "checkedAt": "2026-08-31",
      "sourceIds": [
        "waterbury-tax-rates-2026",
        "waterbury-tax-bills-2025",
        "waterbury-tax-bills-2026"
      ]
    },
    {
      "id": "vermont-property-classification",
      "citationUrl": "https://navigator.govermont.co/records/vermont-property-classification/",
      "statement": "Vermont uses homestead and nonhomestead education-property classifications. Waterbury states that gross annual taxes begin with assessed value divided by 100 and multiplied by the applicable total rate.",
      "limitation": "This does not determine a property's classification, exemptions, state adjustments, credits, assessed value, or net bill.",
      "checkedAt": "2026-08-31",
      "sourceIds": [
        "vermont-tax-bill-guide-2026",
        "waterbury-property-taxes"
      ]
    }
  ],
  "canonicalUnknowns": [
    "Whether the property's assessed value changed.",
    "Whether all or part of the property used the homestead or nonhomestead rate for 2026.",
    "Whether a credit, exemption, state adjustment, penalty, or local agreement changed the net bill.",
    "Which specific line or amount on the resident's bill prompted the question."
  ],
  "civicPaths": [
    {
      "id": "waterbury-property-tax-billing",
      "citationUrl": "https://navigator.govermont.co/records/waterbury-property-tax-billing/",
      "label": "Start with Waterbury property-tax billing",
      "office": "Waterbury Property Tax Billing",
      "purpose": "Questions about a bill, payment, due date, balance, or obtaining a copy",
      "contactMode": "email",
      "checkedAt": "2026-08-31",
      "staleAfter": "2026-09-30",
      "limitation": "This office is a starting point for billing and payment questions, not a determination of assessment correctness or state-credit eligibility.",
      "sourceId": "waterbury-property-taxes"
    },
    {
      "id": "waterbury-assessment-questions",
      "citationUrl": "https://navigator.govermont.co/records/waterbury-assessment-questions/",
      "label": "Start with the Waterbury assessor",
      "office": "Waterbury Town Assessor",
      "purpose": "Questions about an assessed value or reappraisal information",
      "contactMode": "email",
      "checkedAt": "2026-08-31",
      "staleAfter": "2026-09-30",
      "limitation": "This is an assessment-question path, not a promise that a formal 2026 grievance or appeal remains available.",
      "sourceId": "waterbury-property-reappraisal"
    },
    {
      "id": "vermont-homestead-credit-help",
      "citationUrl": "https://navigator.govermont.co/records/vermont-homestead-credit-help/",
      "label": "Start with the Vermont Department of Taxes",
      "office": "Vermont Department of Taxes",
      "purpose": "Homestead declaration, property classification, or property-tax-credit questions",
      "contactMode": "phone_or_appointment",
      "checkedAt": "2026-08-31",
      "staleAfter": "2026-09-30",
      "limitation": "Navigator cannot determine eligibility, credit amount, filing status, or whether a declaration was accepted. Vermont lists October 15, 2026 as the final date it will accept a 2026 declaration or credit claim; verify current timing with the Department.",
      "sourceId": "vermont-homestead-declaration-2026"
    },
    {
      "id": "waterbury-budget-records",
      "citationUrl": "https://navigator.govermont.co/records/waterbury-budget-records/",
      "label": "Start with Waterbury budget and Selectboard records",
      "office": "Waterbury Selectboard public process",
      "purpose": "Understand the municipal budget, meeting record, and voter-approved tax context",
      "contactMode": "records_and_meeting",
      "checkedAt": "2026-08-31",
      "staleAfter": "2026-09-30",
      "limitation": "This path does not claim that every amount in a draft budget packet was adopted unchanged.",
      "sourceId": "waterbury-selectboard-2026"
    }
  ],
  "sources": [
    {
      "id": "waterbury-tax-rates-2026",
      "title": "2026 Tax Rates",
      "publisher": "Town of Waterbury",
      "canonicalUrl": "https://www.waterburyvt.com/departments/taxes/rates",
      "access": "linked_official_source",
      "checkedAt": "2026-08-31",
      "retrievedAt": "2026-08-31",
      "taxYear": 2026,
      "effectiveDate": null,
      "locator": "2026 Taxes table and fiscal-impact summary",
      "evidenceSummary": "Lists the 2026 municipal, education, homestead, nonhomestead, and combined rates and describes the direction of rate changes.",
      "capturedEvidenceSha256": "5baaebe2c2e8d76f13d8fd95693a4bd1d15051cd832c2ecc14d5ba3fa339c532"
    },
    {
      "id": "waterbury-tax-bills-2026",
      "title": "Issued 2026 Property Tax Bills",
      "publisher": "Town of Waterbury",
      "canonicalUrl": null,
      "access": "url_withheld_from_machine_projection",
      "checkedAt": "2026-08-31",
      "retrievedAt": "2026-08-31",
      "taxYear": 2026,
      "effectiveDate": null,
      "locator": "Redacted issued-bill rate fields",
      "evidenceSummary": "Corroborates the town, local-agreement, homestead-education, and nonhomestead-education rate components printed on issued bills.",
      "capturedEvidenceSha256": "e9a91bed7eb2f26eab50796789785103acdccbcb90cb6f13a48c924d5a355e89"
    },
    {
      "id": "waterbury-tax-bills-2025",
      "title": "Issued 2025 Property Tax Bills",
      "publisher": "Town of Waterbury",
      "canonicalUrl": null,
      "access": "url_withheld_from_machine_projection",
      "checkedAt": "2026-08-31",
      "retrievedAt": "2026-08-31",
      "taxYear": 2025,
      "effectiveDate": null,
      "locator": "Redacted issued-bill rate fields",
      "evidenceSummary": "Provides the prior issued-bill rates used only to check the direction of change and identify the unresolved municipal-baseline discrepancy.",
      "capturedEvidenceSha256": "127ca6a488a953ff500959aea2a3d41fe9cbc51e630386a72de47c8249cdd13c"
    },
    {
      "id": "waterbury-property-taxes",
      "title": "Property Taxes",
      "publisher": "Town of Waterbury",
      "canonicalUrl": "https://www.waterburyvt.com/departments/taxes/page",
      "access": "linked_official_source",
      "checkedAt": "2026-08-31",
      "retrievedAt": "2026-08-31",
      "taxYear": 2026,
      "effectiveDate": null,
      "locator": "Calculation guidance, FAQs, and contact section",
      "evidenceSummary": "Defines the per-100 assessed-value unit, lists billing contact details, and directs state homestead and credit questions to Vermont.",
      "capturedEvidenceSha256": "e13c589dc8e785392f70a5174a5767d243325326714418655628c3d81d94d0c2"
    },
    {
      "id": "waterbury-property-reappraisal",
      "title": "Property Reappraisal",
      "publisher": "Town of Waterbury",
      "canonicalUrl": "https://www.waterburyvt.com/departments/taxes/property-reappraisal",
      "access": "linked_official_source",
      "checkedAt": "2026-08-31",
      "retrievedAt": "2026-08-31",
      "taxYear": 2026,
      "effectiveDate": null,